{
  "id": "person_damiano_giorgi",
  "slug": "damiano-giorgi",
  "displayName": "Damiano Giorgi",
  "headline": "",
  "summary": "Former on-prem systems engineer, I always tend to automate tedious tasks and seek tech innovations. I love Cloud Computing! My only hardware focus now is my bass. If not in the office or band room, check the pub or airport!",
  "location": {
    "city": null,
    "country": "IT",
    "region": null
  },
  "avatar": {
    "url": "https://avatars.builderprofile.aws.dev/2f8JrBzb7bdpxxFpuhEyZuMuONq.webp",
    "sourceUrl": "https://builder.aws.com/community/@damiano",
    "sourceType": "aws_builder_center",
    "verified": true
  },
  "programs": [
    {
      "name": "AWS Community Builder",
      "category": "Cloud Operations",
      "startYear": 2024,
      "endYear": null,
      "verificationStatus": "aws_source_verified",
      "sourceUrl": "https://builder.aws.com/community/@damiano",
      "lastCheckedAt": "2026-06-21"
    },
    {
      "name": "New Voices",
      "category": null,
      "startYear": 2026,
      "endYear": null,
      "verificationStatus": "aws_source_verified",
      "sourceUrl": "https://builder.aws.com/community/@damiano",
      "lastCheckedAt": "2026-06-21"
    },
    {
      "name": "AWS Hero",
      "category": "Ai Hero",
      "startYear": 2026,
      "endYear": null,
      "verificationStatus": "aws_source_verified",
      "sourceUrl": "https://builder.aws.com/community/@damiano",
      "lastCheckedAt": "2026-06-21"
    }
  ],
  "topics": [],
  "links": [
    {
      "type": "blog",
      "label": "Blog",
      "url": "https://damianogiorgi.it",
      "handle": null,
      "verified": false,
      "sourceUrl": "https://builder.aws.com/community/@damiano"
    },
    {
      "type": "builder_center",
      "label": "AWS Builder Center",
      "url": "https://builder.aws.com/community/@damiano",
      "handle": null,
      "verified": true,
      "sourceUrl": "https://builder.aws.com/community/@damiano"
    },
    {
      "type": "linkedin",
      "label": "Linkedin",
      "url": "https://www.linkedin.com/in/damiano-giorgi",
      "handle": "damiano-giorgi",
      "verified": false,
      "sourceUrl": "https://builder.aws.com/community/@damiano"
    }
  ],
  "featuredContent": [],
  "sourceEvidence": [
    {
      "sourceType": "aws_builder_center",
      "sourceUrl": "https://builder.aws.com/community/@damiano",
      "retrievedAt": "2026-06-21T18:17:09Z",
      "fields": [
        "avatar",
        "displayName",
        "links",
        "location",
        "programs",
        "summary"
      ]
    }
  ],
  "profileStatus": "draft",
  "ownershipStatus": "unclaimed",
  "lastReviewedAt": null,
  "lastHarvestedAt": "2026-06-21T18:17:09Z"
}
