{
  "id": "person_chao_cai",
  "slug": "chao-cai",
  "displayName": "Chao Cai",
  "headline": "AWS Community Hero",
  "summary": "<p>Chao has 15 years of world-class experience in software development, including more than…</p><p><a href=\"https://aws.amazon.com/developer/community/heroes/chao-cai/?did=dh_card-body&trk=dh_card-body\" target=\"_blank\" rel=\"noopener\">Learn more »</a></p>",
  "location": {
    "city": "Beijing",
    "country": "China",
    "region": null
  },
  "avatar": {
    "url": "https://d1.awsstatic.com/Developer%20Marketing/developer-center/chao-kai.5ac282cd55074e395f94c8189aaceb0e45e8dea2.png",
    "sourceUrl": "https://aws.amazon.com/api/dirs/items/search?item.directoryId=community-heroes&sort_by=item.additionalFields.sortPosition&sort_order=asc&size=2000&item.locale=en_US&tags.id=!community-heroes%23alumni%23alumni-hero",
    "sourceType": "aws_public_page",
    "verified": true
  },
  "programs": [
    {
      "name": "AWS Hero",
      "category": "Community Hero",
      "startYear": 2022,
      "endYear": null,
      "verificationStatus": "aws_source_verified",
      "sourceUrl": "https://aws.amazon.com/api/dirs/items/search?item.directoryId=community-heroes&sort_by=item.additionalFields.sortPosition&sort_order=asc&size=2000&item.locale=en_US&tags.id=!community-heroes%23alumni%23alumni-hero",
      "lastCheckedAt": "2026-06-21"
    }
  ],
  "topics": [
    "Aws Community Hero"
  ],
  "links": [
    {
      "type": "website",
      "label": "AWS public profile",
      "url": "https://aws.amazon.com/developer/community/heroes/chao-cai/?did=dh_card&trk=dh_card",
      "handle": null,
      "verified": true,
      "sourceUrl": "https://aws.amazon.com/developer/community/heroes/chao-cai/?did=dh_card&trk=dh_card"
    }
  ],
  "featuredContent": [],
  "sourceEvidence": [
    {
      "sourceType": "aws_public_page",
      "sourceUrl": "https://aws.amazon.com/api/dirs/items/search?item.directoryId=community-heroes&sort_by=item.additionalFields.sortPosition&sort_order=asc&size=2000&item.locale=en_US&tags.id=!community-heroes%23alumni%23alumni-hero",
      "retrievedAt": "2026-06-21T17:57:40Z",
      "fields": [
        "avatar",
        "displayName",
        "links",
        "location",
        "programs",
        "summary",
        "topics"
      ]
    }
  ],
  "profileStatus": "draft",
  "ownershipStatus": "unclaimed",
  "lastReviewedAt": null,
  "lastHarvestedAt": "2026-06-21T17:57:40Z"
}
