{
  "id": "person_francesco_pochetti",
  "slug": "francesco-pochetti",
  "displayName": "Francesco Pochetti",
  "headline": "AWS Machine Learning Hero",
  "summary": "<p>Francesco first got in touch with Machine Learning back in 2013, taking Stanford's...</p><p><a href=\"https://aws.amazon.com/developer/community/heroes/francesco-pochetti?did=dh_card-body&trk=dh_card-body\" target=\"_blank\" rel=\"noopener\">Learn more »</a></p>",
  "location": {
    "city": null,
    "country": "Luxembourg",
    "region": null
  },
  "avatar": {
    "url": "https://d1.awsstatic.com/Developer%20Marketing/Community%20Heroes/francescop-headshotcircle-100px.ab0355130ea94bfc43d2e356b686863edaddaf1b.png",
    "sourceUrl": "https://aws.amazon.com/api/dirs/items/search?item.directoryId=community-heroes&sort_by=item.additionalFields.sortPosition&sort_order=asc&size=2000&item.locale=en_US&tags.id=!community-heroes%23alumni%23alumni-hero",
    "sourceType": "aws_public_page",
    "verified": true
  },
  "programs": [
    {
      "name": "AWS Hero",
      "category": "Machine Learning Hero",
      "startYear": 2019,
      "endYear": null,
      "verificationStatus": "aws_source_verified",
      "sourceUrl": "https://aws.amazon.com/api/dirs/items/search?item.directoryId=community-heroes&sort_by=item.additionalFields.sortPosition&sort_order=asc&size=2000&item.locale=en_US&tags.id=!community-heroes%23alumni%23alumni-hero",
      "lastCheckedAt": "2026-06-21"
    }
  ],
  "topics": [
    "Aws Machine Learning Hero"
  ],
  "links": [
    {
      "type": "website",
      "label": "AWS public profile",
      "url": "https://aws.amazon.com/developer/community/heroes/francesco-pochetti?did=dh_card&trk=dh_card",
      "handle": null,
      "verified": true,
      "sourceUrl": "https://aws.amazon.com/developer/community/heroes/francesco-pochetti?did=dh_card&trk=dh_card"
    }
  ],
  "featuredContent": [],
  "sourceEvidence": [
    {
      "sourceType": "aws_public_page",
      "sourceUrl": "https://aws.amazon.com/api/dirs/items/search?item.directoryId=community-heroes&sort_by=item.additionalFields.sortPosition&sort_order=asc&size=2000&item.locale=en_US&tags.id=!community-heroes%23alumni%23alumni-hero",
      "retrievedAt": "2026-06-21T17:57:40Z",
      "fields": [
        "avatar",
        "displayName",
        "links",
        "location",
        "programs",
        "summary",
        "topics"
      ]
    }
  ],
  "profileStatus": "draft",
  "ownershipStatus": "unclaimed",
  "lastReviewedAt": null,
  "lastHarvestedAt": "2026-06-21T17:57:40Z"
}
