{
  "id": "person_yan_so",
  "slug": "yan-so",
  "displayName": "Yan So",
  "headline": "",
  "summary": "",
  "location": {
    "city": null,
    "country": null,
    "region": null
  },
  "avatar": {
    "url": "https://avatars.builderprofile.aws.dev/2yJrNuEUCAjqp6yYGe4XwHvgqCH.webp",
    "sourceUrl": "https://builder.aws.com/community/@yanso",
    "sourceType": "aws_builder_center",
    "verified": true
  },
  "programs": [
    {
      "name": "AWS User Group Leader",
      "category": null,
      "startYear": 2026,
      "endYear": null,
      "verificationStatus": "aws_source_verified",
      "sourceUrl": "https://builder.aws.com/community/@yanso",
      "lastCheckedAt": "2026-06-21"
    },
    {
      "name": "AWS Hero",
      "category": "Ai Hero",
      "startYear": 2020,
      "endYear": null,
      "verificationStatus": "aws_source_verified",
      "sourceUrl": "https://builder.aws.com/community/@yanso",
      "lastCheckedAt": "2026-06-21"
    }
  ],
  "topics": [],
  "links": [
    {
      "type": "blog",
      "label": "Blog",
      "url": "https://yanlog.yanbert.com",
      "handle": null,
      "verified": false,
      "sourceUrl": "https://builder.aws.com/community/@yanso"
    },
    {
      "type": "builder_center",
      "label": "AWS Builder Center",
      "url": "https://builder.aws.com/community/@yanso",
      "handle": null,
      "verified": true,
      "sourceUrl": "https://builder.aws.com/community/@yanso"
    },
    {
      "type": "linkedin",
      "label": "Linkedin",
      "url": "https://www.linkedin.com/in/yanso",
      "handle": "yanso",
      "verified": false,
      "sourceUrl": "https://builder.aws.com/community/@yanso"
    }
  ],
  "featuredContent": [],
  "sourceEvidence": [
    {
      "sourceType": "aws_builder_center",
      "sourceUrl": "https://builder.aws.com/community/@yanso",
      "retrievedAt": "2026-06-21T18:18:49Z",
      "fields": [
        "avatar",
        "displayName",
        "links",
        "programs"
      ]
    }
  ],
  "profileStatus": "draft",
  "ownershipStatus": "unclaimed",
  "lastReviewedAt": null,
  "lastHarvestedAt": "2026-06-21T18:18:49Z"
}
