{
  "id": "person_ran_isenberg",
  "slug": "ran-isenberg",
  "displayName": "Ran Isenberg",
  "headline": "Platform engineering, Serverless & Agentic AI | https://www.RanTheBuilder.cloud",
  "summary": "Ran Isenberg is an AWS Serverless Hero, a Senior Principal Software Architect at Palo Alto Network, and a consultant specializing in AI adoption, Platform Engineering and Serverless. With 15+ years of experience in software development and security, Ran has spent the last 6+ years designing and building customer-facing SaaS Serverless services, ensuring the highest production readiness and security standards. Ran maintains a website - RanTheBuilder.cloud where he shares his knowledge and speaking sessions. Ran contributed several utilities to the Powertools for AWS Lambda open-source project and maintains numerous serverless relate open-source projects on his GitHub account. One of these projects is the AWS Lambda cookbook – a serverless service template that gets you started in the serverless world with all the best practices in seconds. Another project is the aws-lambda-env-modeler, a Python library designed to simplify the process of managing and validating environment variables in your AWS Lambda functions. On a personal note, Ran is a proud father of two boys, an amateur barista, and plays the electric guitar. Sessionnize profile: https://sessionize.com/ran-isenberg/",
  "location": {
    "city": null,
    "country": "IL",
    "region": null
  },
  "avatar": {
    "url": "https://avatars.builderprofile.aws.dev/3ClYlBjTsqJ5wn1duKbyjPUsMmX.webp",
    "sourceUrl": "https://builder.aws.com/community/@ranisenberg",
    "sourceType": "aws_builder_center",
    "verified": true
  },
  "programs": [
    {
      "name": "AWS Hero",
      "category": "Serverless Hero",
      "startYear": 2023,
      "endYear": null,
      "verificationStatus": "aws_source_verified",
      "sourceUrl": "https://builder.aws.com/community/@ranisenberg",
      "lastCheckedAt": "2026-06-21"
    }
  ],
  "topics": [],
  "links": [
    {
      "type": "blog",
      "label": "Blog",
      "url": "https://www.ranthebuilder.cloud/",
      "handle": null,
      "verified": false,
      "sourceUrl": "https://builder.aws.com/community/@ranisenberg"
    },
    {
      "type": "builder_center",
      "label": "AWS Builder Center",
      "url": "https://builder.aws.com/community/@ranisenberg",
      "handle": null,
      "verified": true,
      "sourceUrl": "https://builder.aws.com/community/@ranisenberg"
    },
    {
      "type": "github",
      "label": "Github",
      "url": "https://github.com/ran-isenberg",
      "handle": "ran-isenberg",
      "verified": false,
      "sourceUrl": "https://builder.aws.com/community/@ranisenberg"
    },
    {
      "type": "linkedin",
      "label": "Linkedin",
      "url": "https://www.linkedin.com/in/ranbuilder/",
      "handle": "ranbuilder",
      "verified": false,
      "sourceUrl": "https://builder.aws.com/community/@ranisenberg"
    },
    {
      "type": "x",
      "label": "Twitter",
      "url": "https://x.com/RanBuilder",
      "handle": "RanBuilder",
      "verified": false,
      "sourceUrl": "https://builder.aws.com/community/@ranisenberg"
    },
    {
      "type": "youtube",
      "label": "Youtube",
      "url": "https://www.youtube.com/@ranthebuilder",
      "handle": "@ranthebuilder",
      "verified": false,
      "sourceUrl": "https://builder.aws.com/community/@ranisenberg"
    }
  ],
  "featuredContent": [],
  "sourceEvidence": [
    {
      "sourceType": "aws_builder_center",
      "sourceUrl": "https://builder.aws.com/community/@ranisenberg",
      "retrievedAt": "2026-06-21T18:18:11Z",
      "fields": [
        "avatar",
        "displayName",
        "headline",
        "links",
        "location",
        "programs",
        "summary"
      ]
    }
  ],
  "profileStatus": "draft",
  "ownershipStatus": "unclaimed",
  "lastReviewedAt": null,
  "lastHarvestedAt": "2026-06-21T18:18:11Z"
}
