{
  "id": "person_or_hiltch",
  "slug": "or-hiltch",
  "displayName": "Or Hiltch",
  "headline": "CTO",
  "summary": "",
  "location": {
    "city": null,
    "country": "IL",
    "region": null
  },
  "avatar": {
    "url": null,
    "sourceUrl": null,
    "sourceType": "aws_builder_center",
    "verified": false
  },
  "programs": [
    {
      "name": "AWS Hero",
      "category": "Ai Hero",
      "startYear": 2019,
      "endYear": null,
      "verificationStatus": "aws_source_verified",
      "sourceUrl": "https://builder.aws.com/community/@hiltch",
      "lastCheckedAt": "2026-06-21"
    }
  ],
  "topics": [],
  "links": [
    {
      "type": "builder_center",
      "label": "AWS Builder Center",
      "url": "https://builder.aws.com/community/@hiltch",
      "handle": null,
      "verified": true,
      "sourceUrl": "https://builder.aws.com/community/@hiltch"
    },
    {
      "type": "github",
      "label": "Github",
      "url": "https://github.com/orcaman",
      "handle": "orcaman",
      "verified": false,
      "sourceUrl": "https://builder.aws.com/community/@hiltch"
    },
    {
      "type": "linkedin",
      "label": "Linkedin",
      "url": "https://www.linkedin.com/in/hiltch/",
      "handle": "hiltch",
      "verified": false,
      "sourceUrl": "https://builder.aws.com/community/@hiltch"
    },
    {
      "type": "x",
      "label": "Twitter",
      "url": "https://x.com/_orcaman",
      "handle": "_orcaman",
      "verified": false,
      "sourceUrl": "https://builder.aws.com/community/@hiltch"
    }
  ],
  "featuredContent": [],
  "sourceEvidence": [
    {
      "sourceType": "aws_builder_center",
      "sourceUrl": "https://builder.aws.com/community/@hiltch",
      "retrievedAt": "2026-06-21T18:17:31Z",
      "fields": [
        "displayName",
        "headline",
        "links",
        "location",
        "programs"
      ]
    }
  ],
  "profileStatus": "draft",
  "ownershipStatus": "unclaimed",
  "lastReviewedAt": null,
  "lastHarvestedAt": "2026-06-21T18:17:31Z"
}
