{
  "id": "person_tomasz_dudek",
  "slug": "tomasz-dudek",
  "displayName": "Tomasz Dudek",
  "headline": "",
  "summary": "i like ML",
  "location": {
    "city": null,
    "country": "PL",
    "region": null
  },
  "avatar": {
    "url": "https://avatars.builderprofile.aws.dev/2zfVgWSlnqsfRGdECTEzlnNlWa8.webp",
    "sourceUrl": "https://builder.aws.com/community/@tdudek",
    "sourceType": "aws_builder_center",
    "verified": true
  },
  "programs": [
    {
      "name": "AWS User Group Leader",
      "category": null,
      "startYear": 2026,
      "endYear": null,
      "verificationStatus": "aws_source_verified",
      "sourceUrl": "https://builder.aws.com/community/@tdudek",
      "lastCheckedAt": "2026-06-21"
    },
    {
      "name": "AWS Hero",
      "category": "Ai Hero",
      "startYear": 2023,
      "endYear": null,
      "verificationStatus": "aws_source_verified",
      "sourceUrl": "https://builder.aws.com/community/@tdudek",
      "lastCheckedAt": "2026-06-21"
    }
  ],
  "topics": [],
  "links": [
    {
      "type": "builder_center",
      "label": "AWS Builder Center",
      "url": "https://builder.aws.com/community/@tdudek",
      "handle": null,
      "verified": true,
      "sourceUrl": "https://builder.aws.com/community/@tdudek"
    }
  ],
  "featuredContent": [],
  "sourceEvidence": [
    {
      "sourceType": "aws_builder_center",
      "sourceUrl": "https://builder.aws.com/community/@tdudek",
      "retrievedAt": "2026-06-21T18:18:35Z",
      "fields": [
        "avatar",
        "displayName",
        "links",
        "location",
        "programs",
        "summary"
      ]
    }
  ],
  "profileStatus": "draft",
  "ownershipStatus": "unclaimed",
  "lastReviewedAt": null,
  "lastHarvestedAt": "2026-06-21T18:18:35Z"
}
