{
  "id": "person_rossana_suarez",
  "slug": "rossana-suarez",
  "displayName": "Rossana Suarez",
  "headline": "AWS Container Hero",
  "summary": "<p>Rossana Suarez is a DevOps consultant and trainer. She started the &lsquo;295devops&rsquo; channel to share her expertise ...&nbsp;</p> <p><a href=\"https://aws.amazon.com/developer/community/heroes/rossana-suarez/?did=dh_card-body&amp;trk=dh_card-body\" rel=\"noopener\" target=\"_blank\">Learn more &raquo;</a></p>",
  "location": {
    "city": "Resistencia",
    "country": "Argentina",
    "region": null
  },
  "avatar": {
    "url": "https://d1.awsstatic.com/getting-started-guides/new-heros-nov-2022/rossana_suarez-modified.3238f71160f7e6a189ba4e9c26bc59b7ab036a73.png",
    "sourceUrl": "https://aws.amazon.com/api/dirs/items/search?item.directoryId=community-heroes&sort_by=item.additionalFields.sortPosition&sort_order=asc&size=2000&item.locale=en_US&tags.id=!community-heroes%23alumni%23alumni-hero",
    "sourceType": "aws_public_page",
    "verified": true
  },
  "programs": [
    {
      "name": "AWS Hero",
      "category": "Container Hero",
      "startYear": 2022,
      "endYear": null,
      "verificationStatus": "aws_source_verified",
      "sourceUrl": "https://aws.amazon.com/api/dirs/items/search?item.directoryId=community-heroes&sort_by=item.additionalFields.sortPosition&sort_order=asc&size=2000&item.locale=en_US&tags.id=!community-heroes%23alumni%23alumni-hero",
      "lastCheckedAt": "2026-06-21"
    }
  ],
  "topics": [
    "Aws Container Hero"
  ],
  "links": [
    {
      "type": "website",
      "label": "AWS public profile",
      "url": "https://aws.amazon.com/developer/community/heroes/rossana-suarez/?did=dh_card&trk=dh_card",
      "handle": null,
      "verified": true,
      "sourceUrl": "https://aws.amazon.com/developer/community/heroes/rossana-suarez/?did=dh_card&trk=dh_card"
    }
  ],
  "featuredContent": [],
  "sourceEvidence": [
    {
      "sourceType": "aws_public_page",
      "sourceUrl": "https://aws.amazon.com/api/dirs/items/search?item.directoryId=community-heroes&sort_by=item.additionalFields.sortPosition&sort_order=asc&size=2000&item.locale=en_US&tags.id=!community-heroes%23alumni%23alumni-hero",
      "retrievedAt": "2026-06-21T17:57:40Z",
      "fields": [
        "avatar",
        "displayName",
        "links",
        "location",
        "programs",
        "summary",
        "topics"
      ]
    }
  ],
  "profileStatus": "draft",
  "ownershipStatus": "unclaimed",
  "lastReviewedAt": null,
  "lastHarvestedAt": "2026-06-21T17:57:40Z"
}
